ID,Text,Reconnaissance,Resource Development,Initial Access,Execution,Persistence,Privilege Escalation,Defense Evasion,Credential Access,Discovery,Lateral Movement,Collection,Command and Control,Exfiltration,Impact
CVE-2020-16198,"Philips Clinical Collaboration Platform, Versions 12.2.1 and prior. When an attacker claims to have a given identity, the software does not prove or insufficiently proves the claim is correct.",0,0,0,0,0,0,1,0,0,0,0,0,0,0
CVE-2019-6340,"Some field types do not properly sanitize data from non-form sources in Drupal 8.5.x before 8.5.11 and Drupal 8.6.x before 8.6.10. This can lead to arbitrary PHP code execution in some cases. A site is only affected by this if one of the following conditions is met: The site has the Drupal 8 core RESTful Web Services (rest) module enabled and allows PATCH or POST requests, or the site has another web services module enabled, like JSON:API in Drupal 8, or Services or RESTful Web Services in Drupal 7. (Note: The Drupal 7 Services module itself does not require an update at this time, but you should apply other contributed updates associated with this advisory if Services is in use.)",0,0,1,1,0,0,0,0,0,0,0,0,0,0
CVE-2022-27883,A link following vulnerability in Trend Micro Antivirus for Mac 11.5 could allow an attacker to create a specially-crafted file as a symlink that can lead to privilege escalation. Please note that an attacker must at least have low-level privileges on the system to attempt to exploit this vulnerability.,0,0,1,1,0,1,0,0,0,0,0,0,0,0
CVE-2021-25140,"A potential security vulnerability has been identified in the HPE Moonshot Provisioning Manager v1.20. The HPE Moonshot Provisioning Manager is an application that is installed in a VMWare or Microsoft Hyper-V environment that is used to setup and configure an HPE Moonshot 1500 chassis. This vulnerability could be remotely exploited by an unauthenticated user to cause a directory traversal in user supplied input to the `khuploadfile.cgi` CGI ELF. The directory traversal could lead to Remote Code Execution, Denial of Service, and/or compromise system integrity. **Note:** HPE recommends that customers discontinue the use of the HPE Moonshot Provisioning Manager. The HPE Moonshot Provisioning Manager application is discontinued, no longer supported, is not available to download from the HPE Support Center, and no patch is available.",0,0,0,1,0,0,0,0,1,0,0,0,0,1
CVE-2018-8835,Double free vulnerabilities in Advantech WebAccess HMI Designer 2.1.7.32 and prior caused by processing specially crafted .pm3 files may allow remote code execution.,0,0,0,1,1,0,0,0,0,0,0,0,0,0
CVE-2018-1000861,"A code execution vulnerability exists in the Stapler web framework used by Jenkins 2.153 and earlier, LTS 2.138.3 and earlier in stapler/core/src/main/java/org/kohsuke/stapler/MetaClass.java that allows attackers to invoke some methods on Java objects by accessing crafted URLs that were not intended to be invoked this way.",0,0,1,0,0,0,0,0,0,0,0,0,0,0
CVE-2022-21672,"make-ca is a utility to deliver and manage a complete PKI configuration for workstations and servers. Starting with version 0.9 and prior to version 1.10, make-ca misinterprets Mozilla certdata.txt and treats explicitly untrusted certificates like trusted ones, causing those explicitly untrusted certificates trusted by the system. The explicitly untrusted certificates were used by some CAs already hacked. Hostile attackers may perform a MIM attack exploiting them. Everyone using the affected versions of make-ca should upgrade to make-ca-1.10, and run `make-ca -f -g` as the `root` user to regenerate the trusted store immediately. As a workaround, users may delete the untrusted certificates from /etc/pki/tls and /etc/ssl/certs manually (or by a script), but this is not recommended because the manual changes will be overwritten next time running make-ca to update the trusted anchor.",0,0,0,0,0,0,0,1,0,0,1,0,0,0
CVE-2018-8110,"A remote code execution vulnerability exists when Microsoft Edge improperly accesses objects in memory, aka ""Microsoft Edge Memory Corruption Vulnerability."" This affects Microsoft Edge. This CVE ID is unique from CVE-2018-8111, CVE-2018-8236.",0,0,1,1,1,0,0,0,0,0,1,0,0,1
CVE-2018-11776,"Apache Struts versions 2.3 to 2.3.34 and 2.5 to 2.5.16 suffer from possible Remote Code Execution when alwaysSelectFullNamespace is true (either by user or a plugin like Convention Plugin) and then: results are used with no namespace and in same time, its upper package have no or wildcard namespace and similar to results, same possibility when using url tag which doesn't have value and action set and in same time, its upper package have no or wildcard namespace.",0,0,0,0,0,1,0,0,0,0,0,0,0,0
CVE-2020-14316,A flaw was found in kubevirt 0.29 and earlier. Virtual Machine Instances (VMIs) can be used to gain access to the host's filesystem. Successful exploitation allows an attacker to assume the privileges of the VM process on the host system. In worst-case scenarios an attacker can read and modify any file on the system where the VMI is running. The highest threat from this vulnerability is to data confidentiality and integrity as well as system availability.,0,0,0,0,0,1,0,0,0,0,0,0,0,1
CVE-2022-28468,Payroll Management System v1.0 was discovered to contain a SQL injection vulnerability via the username parameter.,0,0,1,1,0,0,0,0,0,0,0,0,0,0
CVE-2019-1768,"A vulnerability in the implementation of a specific CLI command for Cisco NX-OS Software could allow an authenticated, local attacker with administrator credentials to cause a buffer overflow condition or perform command injection. This could allow the attacker to execute arbitrary commands with elevated privileges on the underlying operating system of an affected device. The vulnerability is due to insufficient validation of arguments passed to a certain CLI command. An attacker could exploit this vulnerability by including malicious input as the argument of the affected CLI command. A successful exploit could allow the attacker to execute arbitrary commands on the underlying operating system with root privileges. An attacker would need valid administrator credentials to exploit these vulnerabilities.",0,1,1,1,0,0,0,0,0,0,0,0,0,0
CVE-2021-29628,"In FreeBSD 13.0-STABLE before n245764-876ffe28796c, 12.2-STABLE before r369857, 13.0-RELEASE before p1, and 12.2-RELEASE before p7, a system call triggering a fault could cause SMAP protections to be disabled for the duration of the system call. This weakness could be combined with other kernel bugs to craft an exploit.",0,1,0,0,0,0,0,0,0,0,0,0,0,0
CVE-2020-15892,"An issue was discovered in apply.cgi on D-Link DAP-1520 devices before 1.10b04Beta02. Whenever a user performs a login action from the web interface, the request values are being forwarded to the ssi binary. On the login page, the web interface restricts the password input field to a fixed length of 15 characters. The problem is that validation is being done on the client side, hence it can be bypassed. When an attacker manages to intercept the login request (POST based) and tampers with the vulnerable parameter (log_pass), to a larger length, the request will be forwarded to the webserver. This results in a stack-based buffer overflow. A few other POST variables, (transferred as part of the login request) are also vulnerable: html_response_page and log_user.",0,0,1,0,0,1,0,0,0,0,0,0,0,0
CVE-2020-5339,"RSA Authentication Manager versions prior to 8.4 P10 contain a stored cross-site scripting vulnerability in the Security Console. A malicious RSA Authentication Manager Security Console administrator with advanced privileges could exploit this vulnerability to store arbitrary HTML or JavaScript code through the Security Console web interface. When other Security Console administrators open the affected report page, the injected scripts could potentially be executed in their browser.",0,0,1,1,0,0,0,0,0,0,1,0,0,0
CVE-2021-35213,An Improper Access Control Privilege Escalation Vulnerability was discovered in the User Setting of Orion Platform version 2020.2.5. It allows a guest user to elevate privileges to the Administrator using this vulnerability. Authentication is required to exploit the vulnerability.,0,0,0,0,0,1,0,0,0,0,0,0,0,0
CVE-2018-11069,"RSA BSAFE SSL-J versions prior to 6.2.4 contain a Covert Timing Channel vulnerability during RSA decryption, also known as a Bleichenbacher attack on RSA decryption. A remote attacker may be able to recover a RSA key.",0,0,0,0,0,0,1,1,0,0,0,0,0,0
CVE-2020-3151,"A vulnerability in the CLI of Cisco Connected Mobile Experiences (CMX) could allow an authenticated, local attacker with administrative credentials to bypass restrictions on the CLI. The vulnerability is due to insufficient security mechanisms in the restricted shell implementation. An attacker could exploit this vulnerability by sending crafted commands to the CLI. A successful exploit could allow the attacker to escape the restricted shell and execute a set of normally unauthorized commands with the privileges of a non-root user. To exploit this vulnerability, an attacker would need to have valid administrative credentials.",0,0,1,0,0,1,1,0,0,0,0,0,0,0
CVE-2021-35233,"The HTTP TRACK & TRACE methods were enabled in Kiwi Syslog Server 9.7.1 and earlier. These methods are intended for diagnostic purposes only. If enabled, the web server will respond to requests that use these methods by returning exact HTTP request that was received in the response to the client. This may lead to the disclosure of sensitive information such as internal authentication headers appended by reverse proxies.",0,0,0,0,0,0,0,0,0,0,1,0,0,0
CVE-2011-2005,"afd.sys in the Ancillary Function Driver in Microsoft Windows XP SP2 and SP3 and Server 2003 SP2 does not properly validate user-mode input passed to kernel mode, which allows local users to gain privileges via a crafted application, aka ""Ancillary Function Driver Elevation of Privilege Vulnerability.""",0,0,0,1,0,0,0,0,0,0,0,0,0,0
CVE-2020-10924,"This vulnerability allows network-adjacent attackers to bypass authentication on affected installations of NETGEAR R6700 V1.0.4.84_10.0.58 routers. Although authentication is required to exploit this vulnerability, the existing authentication mechanism can be bypassed. The specific flaw exists within the UPnP service, which listens on TCP port 5000 by default. The issue results from the lack of proper validation of the length of user-supplied data prior to copying it to a fixed-length, stack-based buffer. An attacker can leverage this vulnerability to execute code in the context of root. Was ZDI-CAN-9643.",0,0,1,0,1,1,0,0,0,1,0,0,0,0
CVE-2020-3349,"Multiple vulnerabilities in the web-based management interface of Cisco Data Center Network Manager (DCNM) could allow an authenticated, remote attacker to conduct a cross-site scripting (XSS) attack against a user of the interface on an affected device. These vulnerabilities are due to insufficient validation of user-supplied input by the web-based management interface. An attacker could exploit these vulnerabilities by persuading a user of the interface to click a customized link. A successful exploit could allow the attacker to execute arbitrary script code in the context of the interface or access sensitive browser-based information.",0,0,0,1,0,0,0,1,0,0,0,0,0,0
CVE-2020-10549,"rConfig 3.9.4 and previous versions has unauthenticated snippets.inc.php SQL injection. Because, by default, nodes' passwords are stored in cleartext, this vulnerability leads to lateral movement, granting an attacker access to monitored network devices.",0,0,0,1,0,0,0,0,0,1,0,0,0,0
CVE-2021-34825,"Quassel through 0.13.1, when --require-ssl is enabled, launches without SSL or TLS support if a usable X.509 certificate is not found on the local system.",1,0,0,0,0,0,0,0,0,0,0,0,0,0
CVE-2020-3473,"A vulnerability in task group assignment for a specific CLI command in Cisco IOS XR Software could allow an authenticated, local CLI shell user to elevate privileges and gain full administrative control of the device. The vulnerability is due to incorrect mapping of a command to task groups within the source code. An attacker could exploit this vulnerability by first authenticating to the local CLI shell on the device and using the CLI command to bypass the task group&ndash;based checks. A successful exploit could allow the attacker to elevate privileges and perform actions on the device without authorization checks.",0,0,1,0,0,1,0,0,0,0,0,0,0,0
CVE-2018-7506,"The private key of the web server in Moxa MXview versions 2.8 and prior is able to be read and accessed via an HTTP GET request, which may allow a remote attacker to decrypt encrypted information.",0,0,1,0,0,0,0,1,0,0,0,0,0,0
CVE-2019-15994,"A vulnerability in the web-based management interface of Cisco Stealthwatch Enterprise could allow an unauthenticated, remote attacker to conduct a cross-site scripting (XSS) attack against a user of the web-based management interface of an affected system. The vulnerability is due to insufficient validation of user-supplied input by the web-based management interface of the affected software. An attacker could exploit this vulnerability by persuading a user to click a crafted link. A successful exploit could allow the attacker to execute arbitrary script code in the context of the affected interface or access sensitive, browser-based information.",0,0,0,1,0,0,0,1,0,0,0,0,0,0
CVE-2020-5373,Dell EMC OpenManage Integration for Microsoft System Center (OMIMSSC) for SCCM and SCVMM versions prior to 7.2.1 contain an improper authentication vulnerability. A remote unauthenticated attacker may potentially exploit this vulnerability to retrieve the system inventory data of the managed device.,0,0,1,0,0,0,0,0,0,0,1,0,0,0
CVE-2017-0213,"Windows COM Aggregate Marshaler in Microsoft Windows Server 2008 SP2 and R2 SP1, Windows 7 SP1, Windows 8.1, Windows Server 2012 Gold and R2, Windows RT 8.1, Windows 10 Gold, 1511, 1607, and 1703, and Windows Server 2016 allows an elevation privilege vulnerability when an attacker runs a specially crafted application, aka ""Windows COM Elevation of Privilege Vulnerability"". This CVE ID is unique from CVE-2017-0214.",0,0,0,0,0,1,1,0,0,0,0,0,0,0
CVE-2018-8160,"An information disclosure vulnerability exists in Outlook when a message is opened, aka ""Microsoft Outlook Information Disclosure Vulnerability."" This affects Word, Microsoft Office.",0,0,1,0,0,0,0,1,0,0,1,0,0,0
CVE-2020-25889,Online Bus Booking System Project Using PHP/MySQL version 1.0 has SQL injection via the login page. By placing SQL injection payload on the login page attackers can bypass the authentication and can gain the admin privilege.,0,0,1,0,0,1,1,0,0,0,0,0,0,0
CVE-2022-27419,rtl_433 21.12 was discovered to contain a stack overflow in the function acurite_00275rm_decode at /devices/acurite.c. This vulnerability allows attackers to cause a Denial of Service (DoS) via a crafted file.,0,0,0,1,0,0,0,0,0,0,0,0,0,1
CVE-2020-5261,"Saml2 Authentication services for ASP.NET (NuGet package Sustainsys.Saml2) greater than 2.0.0, and less than version 2.5.0 has a faulty implementation of Token Replay Detection. Token Replay Detection is an important defence in depth measure for Single Sign On solutions. The 2.5.0 version is patched. Note that version 1.0.1 is not affected. It has a correct Token Replay Implementation and is safe to use. Saml2 Authentication services for ASP.NET (NuGet package Sustainsys.Saml2) greater than 2.0.0, and less than version 2.5.0 have a faulty implementation of Token Replay Detection. Token Replay Detection is an important defense measure for Single Sign On solutions. The 2.5.0 version is patched. Note that version 1.0.1 and prior versions are not affected. These versions have a correct Token Replay Implementation and are safe to use.",0,0,1,0,0,0,0,1,0,0,0,0,0,0
CVE-2020-3403,"A vulnerability in the CLI of Cisco IOS XE Software could allow an authenticated, local attacker to inject a command to the underlying operating system that will execute with root privileges upon the next reboot of the device. The authenticated user must have privileged EXEC permissions on the device. The vulnerability is due to insufficient protection of values passed to a script that executes during device startup. An attacker could exploit this vulnerability by writing values to a specific file. A successful exploit could allow the attacker to execute commands with root privileges each time the affected device is restarted.",0,0,1,1,0,1,0,0,0,0,0,0,0,0
CVE-2021-20196,"A NULL pointer dereference flaw was found in the floppy disk emulator of QEMU. This issue occurs while processing read/write ioport commands if the selected floppy drive is not initialized with a block device. This flaw allows a privileged guest user to crash the QEMU process on the host, resulting in a denial of service. The highest threat from this vulnerability is to system availability.",0,0,0,0,0,0,0,0,0,0,0,0,0,1
CVE-2020-6819,"Under certain conditions, when running the nsDocShell destructor, a race condition can cause a use-after-free. We are aware of targeted attacks in the wild abusing this flaw. This vulnerability affects Thunderbird < 68.7.0, Firefox < 74.0.1, and Firefox ESR < 68.6.1.",0,0,1,1,0,0,0,0,0,0,0,0,0,0
CVE-2020-11957,The Bluetooth Low Energy implementation in Cypress PSoC Creator BLE 4.2 component versions before 3.64 generates a random number (Pairing Random) with significantly less entropy than the specified 128 bits during BLE pairing. This is the case for both authenticated and unauthenticated pairing with both LE Secure Connections as well as LE Legacy Pairing. A predictable or brute-forceable random number allows an attacker (in radio range) to perform a MITM attack during BLE pairing.,0,0,0,0,0,0,0,1,0,0,0,0,0,0
CVE-2020-3306,"A vulnerability in the DHCP module of Cisco Adaptive Security Appliance (ASA) Software and Cisco Firepower Threat Defense (FTD) Software could allow an unauthenticated, remote attacker to cause a denial of service (DoS) condition on the affected device. The vulnerability is due to incorrect processing of certain DHCP packets. An attacker could exploit this vulnerability by sending a crafted DHCP packet to the affected device. A successful exploit could allow the attacker to cause a DoS condition on the affected device.",0,0,1,0,0,0,0,0,0,0,0,0,0,1
CVE-2012-4681,"Multiple vulnerabilities in the Java Runtime Environment (JRE) component in Oracle Java SE 7 Update 6 and earlier allow remote attackers to execute arbitrary code via a crafted applet that bypasses SecurityManager restrictions by (1) using com.sun.beans.finder.ClassFinder.findClass and leveraging an exception with the forName method to access restricted classes from arbitrary packages such as sun.awt.SunToolkit, then (2) using ""reflection with a trusted immediate caller"" to leverage the getField method to access and modify private fields, as exploited in the wild in August 2012 using Gondzz.class and Gondvv.class.",0,0,1,1,0,1,1,0,1,0,0,0,0,0
CVE-2021-34557,XScreenSaver 5.45 can be bypassed if the machine has more than ten disconnectable video outputs. A buffer overflow in update_screen_layout() allows an attacker to bypass the standard screen lock authentication mechanism by crashing XScreenSaver. The attacker must physically disconnect many video outputs.,0,0,0,0,1,0,0,0,0,0,0,0,0,0
CVE-2022-0489,An issue has been discovered in GitLab CE/EE affecting all versions starting with 8.15 . It was possible to trigger a DOS by using the math feature with a specific formula in issue comments.,0,0,0,1,0,0,0,0,0,0,0,0,0,1
CVE-2015-1805,"The (1) pipe_read and (2) pipe_write implementations in fs/pipe.c in the Linux kernel before 3.16 do not properly consider the side effects of failed __copy_to_user_inatomic and __copy_from_user_inatomic calls, which allows local users to cause a denial of service (system crash) or possibly gain privileges via a crafted application, aka an ""I/O vector array overrun.""",0,0,0,0,0,1,0,0,0,0,0,0,0,0
CVE-2021-34816,An Argument Injection issue in the plugin management of Etherpad 1.8.13 allows privileged users to execute arbitrary code on the server by installing plugins from an attacker-controlled source.,0,0,0,1,0,0,0,0,0,0,0,0,0,0
CVE-2020-12863,"An out-of-bounds read in SANE Backends before 1.0.30 may allow a malicious device connected to the same local network as the victim to read important information, such as the ASLR offsets of the program, aka GHSL-2020-083.",0,0,0,0,0,0,1,0,0,0,1,0,0,0
CVE-2010-1423,"Argument injection vulnerability in the URI handler in (a) Java NPAPI plugin and (b) Java Deployment Toolkit in Java 6 Update 10, 19, and other versions, when running on Windows and possibly on Linux, allows remote attackers to execute arbitrary code via the (1) -J or (2) -XXaltjvm argument to javaws.exe, which is processed by the launch method.  NOTE: some of these details are obtained from third party information.",0,0,1,1,0,0,0,0,0,0,0,0,0,0
CVE-2021-44453,"mySCADA myPRO: Versions 8.20.0 and prior has a vulnerable debug interface which includes a ping utility, which may allow an attacker to inject arbitrary operating system commands.",0,0,0,1,0,0,1,0,0,0,0,0,0,0
CVE-2020-35584,"In Solstice Pod before 3.0.3, the web services allow users to connect to them over unencrypted channels via the Browser Look-in feature. An attacker suitably positioned to view a legitimate user's network traffic could record and monitor their interactions with the web services and obtain any information the user supplies, including Administrator passwords and screen keys.",0,0,1,0,0,0,0,0,0,0,1,0,1,0
CVE-2019-18234,"Equinox Control Expert all versions, is vulnerable to an SQL injection attack, which may allow an attacker to remotely execute arbitrary code.",0,0,1,1,1,0,0,0,0,0,1,0,0,1
CVE-2016-0165,"The kernel-mode driver in Microsoft Windows Vista SP2, Windows Server 2008 SP2 and R2 SP1, Windows 7 SP1, Windows 8.1, Windows Server 2012 Gold and R2, Windows RT 8.1, and Windows 10 Gold and 1511 allows local users to gain privileges via a crafted application, aka ""Win32k Elevation of Privilege Vulnerability,"" a different vulnerability than CVE-2016-0143 and CVE-2016-0167.",0,1,0,0,0,0,0,0,0,0,0,0,0,0
CVE-2020-11532,Zoho ManageEngine DataSecurity Plus prior to 6.0.1 uses default admin credentials to communicate with a DataEngine Xnode server. This allows an attacker to bypass authentication for this server and execute all operations in the context of admin user.,0,0,1,0,1,1,0,0,0,1,0,0,0,0
CVE-2019-1889,"A vulnerability in the REST API for software device management in Cisco Application Policy Infrastructure Controller (APIC) Software could allow an authenticated, remote attacker to escalate privileges to root on an affected device. The vulnerability is due to incomplete validation and error checking for the file path when specific software is uploaded. An attacker could exploit this vulnerability by uploading malicious software using the REST API. A successful exploit could allow an attacker to escalate their privilege level to root. The attacker would need to have the administrator role on the device.",0,0,1,0,0,1,0,0,0,0,0,0,0,0
CVE-2016-0099,"The Secondary Logon Service in Microsoft Windows Vista SP2, Windows Server 2008 SP2 and R2 SP1, Windows 7 SP1, Windows 8.1, Windows Server 2012 Gold and R2, Windows RT 8.1, and Windows 10 Gold and 1511 does not properly process request handles, which allows local users to gain privileges via a crafted application, aka ""Secondary Logon Elevation of Privilege Vulnerability.""",0,0,0,0,0,1,0,0,0,0,0,0,0,0
CVE-2021-30463,"VestaCP through 0.9.8-24 allows attackers to gain privileges by creating symlinks to files for which they lack permissions. After reading the RKEY value from user.conf under the /usr/local/vesta/data/users/admin directory, the admin password can be changed via a /reset/?action=confirm&user=admin&code= URI. This occurs because chmod is used unsafely.",0,0,0,0,1,0,0,1,0,0,0,0,0,0
CVE-2010-1297,"Adobe Flash Player before 9.0.277.0 and 10.x before 10.1.53.64; Adobe AIR before 2.0.2.12610; and Adobe Reader and Acrobat 9.x before 9.3.3, and 8.x before 8.2.3 on Windows and Mac OS X, allow remote attackers to execute arbitrary code or cause a denial of service (memory corruption) via crafted SWF content, related to authplay.dll and the ActionScript Virtual Machine 2 (AVM2) newfunction instruction, as exploited in the wild in June 2010.",0,0,0,1,0,0,0,0,0,0,0,0,0,0
CVE-2009-0556,"Microsoft Office PowerPoint 2000 SP3, 2002 SP3, and 2003 SP3, and PowerPoint in Microsoft Office 2004 for Mac, allows remote attackers to execute arbitrary code via a PowerPoint file with an OutlineTextRefAtom containing an an invalid index value that triggers memory corruption, as exploited in the wild in April 2009 by Exploit:Win32/Apptom.gen, aka ""Memory Corruption Vulnerability.""",0,0,0,1,0,0,0,0,0,0,0,0,0,0
CVE-2020-3322,A vulnerability in Cisco Webex Network Recording Player and Cisco Webex Player for Microsoft Windows could allow an attacker to cause a process crash resulting in a Denial of service (DoS) condition for the player application on an affected system. The vulnerability exists due to insufficient validation of certain elements with a Webex recording stored in either the Advanced Recording Format (ARF) or the Webex Recording Format (WRF). An attacker could exploit this vulnerability by sending a user a malicious ARF or WRF file through a link or email attachment and persuading the user to open the file with the affected software on the local system. A successful exploit could allow the attacker to cause the Webex player application to crash when trying to view the malicious file.,0,0,1,1,0,0,0,0,0,0,0,0,0,1
