ID,Text,Reconnaissance,Resource Development,Initial Access,Execution,Persistence,Privilege Escalation,Defense Evasion,Credential Access,Discovery,Lateral Movement,Collection,Command and Control,Exfiltration,Impact
CVE-2014-6324,"The Kerberos Key Distribution Center (KDC) in Microsoft Windows Server 2003 SP2, Windows Vista SP2, Windows Server 2008 SP2 and R2 SP1, Windows 7 SP1, Windows 8, Windows 8.1, and Windows Server 2012 Gold and R2 allows remote authenticated domain users to obtain domain administrator privileges via a forged signature in a ticket, as exploited in the wild in November 2014, aka ""Kerberos Checksum Vulnerability.""",0,0,0,0,0,1,0,1,0,0,0,0,0,0
CVE-2021-21722,"A ZTE Smart STB is impacted by an information leak vulnerability. The device did not fully verify the log, so attackers could use this vulnerability to obtain sensitive user information for further information detection and attacks. This affects: ZXV10 B860A V2.1-T_V0032.1.1.04_jiangsuTelecom.",1,0,0,0,0,0,0,0,0,0,0,0,0,0
CVE-2018-10610,"An out-of-bounds vulnerability in LeviStudioU, Versions 1.8.29 and 1.8.44 can be exploited when the application processes specially crafted project files.",0,0,0,0,1,0,0,1,0,0,1,0,0,1
CVE-2017-16651,"Roundcube Webmail before 1.1.10, 1.2.x before 1.2.7, and 1.3.x before 1.3.3 allows unauthorized access to arbitrary files on the host's filesystem, including configuration files, as exploited in the wild in November 2017. The attacker must be able to authenticate at the target system with a valid username/password as the attack requires an active session. The issue is related to file-based attachment plugins and _task=settings&_action=upload-display&_from=timezone requests.",0,0,1,0,0,0,0,0,0,0,1,0,0,0
CVE-2022-27463,"Open redirect vulnerability in objects/login.json.php in WWBN AVideo through 11.6, allows attackers to arbitrarily redirect users from a crafted url to the login page.",0,0,1,0,0,0,0,0,0,0,0,0,0,0
CVE-2020-3433,"A vulnerability in the interprocess communication (IPC) channel of Cisco AnyConnect Secure Mobility Client for Windows could allow an authenticated, local attacker to perform a DLL hijacking attack. To exploit this vulnerability, the attacker would need to have valid credentials on the Windows system. The vulnerability is due to insufficient validation of resources that are loaded by the application at run time. An attacker could exploit this vulnerability by sending a crafted IPC message to the AnyConnect process. A successful exploit could allow the attacker to execute arbitrary code on the affected machine with SYSTEM privileges. To exploit this vulnerability, the attacker would need to have valid credentials on the Windows system.",0,0,1,1,1,0,0,0,0,0,0,0,0,0
CVE-2020-5210,"In NetHack before 3.6.5, an invalid argument to the -w command line option can cause a buffer overflow resulting in a crash or remote code execution/privilege escalation. This vulnerability affects systems that have NetHack installed suid/sgid and shared systems that allow users to influence command line options. Users should upgrade to NetHack 3.6.5.",0,0,0,0,1,0,0,0,0,0,0,0,0,1
CVE-2020-7848,"The EFM ipTIME C200 IP Camera is affected by a Command Injection vulnerability in /login.cgi?logout=1 script. To exploit this vulnerability, an attacker can send a GET request that executes arbitrary OS commands via cookie value.",0,0,0,1,0,0,0,1,0,0,0,0,0,0
CVE-2021-33794,Foxit Reader before 10.1.4 and PhantomPDF before 10.1.4 allow information disclosure or an application crash after mishandling the Tab key during XFA form interaction.,0,0,0,0,0,0,0,0,0,0,1,0,1,1
CVE-2019-13511,Rockwell Automation Arena Simulation Software versions 16.00.00 and earlier contain an INFORMATION EXPOSURE CWE-200. A maliciously crafted Arena file opened by an unsuspecting user may result in the limited exposure of information related to the targeted workstation.,0,0,0,1,0,0,0,0,0,0,1,0,0,0
CVE-2021-34529,Visual Studio Code Remote Code Execution Vulnerability This CVE ID is unique from CVE-2021-34528.,0,0,0,1,0,0,0,0,0,0,0,0,0,0
CVE-2018-18995,"Pluto Safety PLC Gateway Ethernet devices ABB GATE-E1 and GATE-E2 all versions do not allow authentication to be configured on administrative telnet or web interfaces, which could enable various effects vectors, including conducting device resets, reading or modifying registers, and changing configuration settings such as IP addresses.",0,0,0,0,0,0,0,0,0,0,1,0,0,1
CVE-2020-25187,"Medtronic MyCareLink Smart 25000 all versions are vulnerable when an attacker who gains auth runs a debug command, which is sent to the reader causing heap overflow in the MCL Smart Reader stack. A heap overflow allows attacker to remotely execute code on the MCL Smart Reader, could lead to control of device.",0,0,0,1,1,1,0,0,0,0,0,0,0,0
CVE-2020-12014,"Advantech WebAccess Node, Version 8.4.4 and prior, Version 9.0.0. Input is not properly sanitized and may allow an attacker to inject SQL commands.",0,0,0,1,0,0,0,0,0,0,0,0,0,0
CVE-2016-7189,"The Chakra JavaScript engine in Microsoft Edge allows remote attackers to execute arbitrary code via a crafted web site, aka ""Scripting Engine Remote Code Execution Vulnerability.""",0,0,1,1,0,0,0,0,0,0,0,0,0,0
CVE-2020-1741,"A flaw was found in openshift-ansible. OpenShift Container Platform (OCP) 3.11 is too permissive in the way it specified CORS allowed origins during installation. An attacker, able to man-in-the-middle the connection between the user's browser and the openshift console, could use this flaw to perform a phishing attack. The main threat from this vulnerability is data confidentiality.",0,0,1,0,0,0,0,0,0,0,1,0,0,0
CVE-2021-34371,"Neo4j through 3.4.18 (with the shell server enabled) exposes an RMI service that arbitrarily deserializes Java objects, e.g., through setSessionVariable. An attacker can abuse this for remote code execution because there are dependencies with exploitable gadget chains.",0,0,0,1,0,0,0,0,0,0,0,0,0,0
CVE-2020-3460,"A vulnerability in the web-based management interface of Cisco Data Center Network Manager (DCNM) could allow an unauthenticated, remote attacker to conduct a cross-site scripting (XSS) attack against a user of the interface. The vulnerability exists because the web-based management interface does not properly validate user-supplied input. An attacker could exploit this vulnerability by intercepting a request from a user and injecting malicious data into an HTTP header. A successful exploit could allow the attacker to execute arbitrary script code in the context of the affected interface or access sensitive browser-based information.",0,0,0,0,0,0,0,0,0,0,1,0,0,1
CVE-2020-24046,"A sandbox escape issue was discovered in TitanHQ SpamTitan Gateway 7.07. It limits the admin user to a restricted shell, allowing execution of a small number of tools of the operating system. This restricted shell can be bypassed after changing the properties of the user admin in the operating system file /etc/passwd. This file cannot be accessed though the restricted shell, but it can be modified by abusing the Backup/Import Backup functionality of the web interface. An authenticated attacker would be able to obtain the file /var/tmp/admin.passwd after executing a Backup operation. This file can be manually modified to change the GUID of the user to 0 (root) and change the restricted shell to a normal shell /bin/sh. After the modification is done, the file can be recompressed to a .tar.bz file and imported again via the Import Backup functionality. The properties of the admin user will be overwritten and a root shell will be granted to the user upon the next successful login.",0,0,1,0,1,1,1,0,0,1,0,0,0,0
CVE-2014-0322,"Use-after-free vulnerability in Microsoft Internet Explorer 9 and 10 allows remote attackers to execute arbitrary code via vectors involving crafted JavaScript code, CMarkup, and the onpropertychange attribute of a script element, as exploited in the wild in January and February 2014.",0,0,0,0,0,1,0,0,0,0,0,0,0,0
CVE-2021-31542,"In Django 2.2 before 2.2.21, 3.1 before 3.1.9, and 3.2 before 3.2.1, MultiPartParser, UploadedFile, and FieldFile allowed directory traversal via uploaded files with suitably crafted file name",0,0,0,1,0,0,0,0,1,0,0,0,0,0
CVE-2014-2523,"net/netfilter/nf_conntrack_proto_dccp.c in the Linux kernel through 3.13.6 uses a DCCP header pointer incorrectly, which allows remote attackers to cause a denial of service (system crash) or possibly execute arbitrary code via a DCCP packet that triggers a call to the (1) dccp_new, (2) dccp_packet, or (3) dccp_error function",0,0,0,1,0,0,1,0,0,0,0,0,0,1
CVE-2019-15976,"Multiple vulnerabilities in the authentication mechanisms of Cisco Data Center Network Manager (DCNM) could allow an unauthenticated, remote attacker to bypass authentication and execute arbitrary actions with administrative privileges on an affected device. For more information about these vulnerabilities, see the Details section of this advisory.",0,0,1,1,0,1,0,0,0,0,0,0,0,0
CVE-2021-34485,.NET Core and Visual Studio Information Disclosure Vulnerability,0,0,0,0,0,0,0,0,0,0,1,0,0,0
CVE-2021-44515,"Zoho ManageEngine Desktop Central is vulnerable to authentication bypass, leading to remote code execution on the server, as exploited in the wild in December 2021. For Enterprise builds 10.1.2127.17 and earlier, upgrade to 10.1.2127.18. For Enterprise builds 10.1.2128.0 through 10.1.2137.2, upgrade to 10.1.2137.3. For MSP builds 10.1.2127.17 and earlier, upgrade to 10.1.2127.18. For MSP builds 10.1.2128.0 through 10.1.2137.2, upgrade to 10.1.2137.3.",0,0,0,0,0,0,1,0,0,0,0,0,0,0
CVE-2018-8248,"A remote code execution vulnerability exists in Microsoft Excel software when the software fails to properly handle objects in memory, aka ""Microsoft Excel Remote Code Execution Vulnerability."" This affects Microsoft Office.",0,0,1,1,1,0,0,0,0,0,1,0,0,1
CVE-2021-22359,"There is a denial of service vulnerability in the verisions V200R005C00SPC500 of S5700 and V200R005C00SPC500 of S6700. An attacker could exploit this vulnerability by sending specific message to a targeted device. Due to insufficient input validation, successful exploit can cause the service abnormal.",0,0,0,0,0,0,0,0,0,0,0,0,0,1
CVE-2019-15243,"Multiple vulnerabilities in Cisco SPA100 Series Analog Telephone Adapters (ATAs) could allow an authenticated, adjacent attacker to execute arbitrary code with elevated privileges. The vulnerabilities are due to improper validation of user-supplied input to the web-based management interface. An attacker could exploit these vulnerabilities by authenticating to the web-based management interface and sending crafted requests to an affected device. A successful exploit could allow the attacker to execute arbitrary code with elevated privileges. Note: The web-based management interface is enabled by default.",0,0,1,1,1,0,0,0,0,0,0,0,0,0
CVE-2018-11084,"Cloud Foundry Garden-runC release, versions prior to 1.16.1, prevents deletion of some app environments based on file attributes. A remote authenticated malicious user may create and delete apps with crafted file attributes to cause a denial of service for new app instances or scaling up of existing apps.",0,0,0,0,0,0,0,0,0,0,0,0,0,1
CVE-2020-6876,"A ZTE product is impacted by an XSS vulnerability. The vulnerability is caused by the lack of correct verification of client data in the WEB module. By inserting malicious scripts into the web module, a remote attacker could trigger an XSS attack when the user browses the web page. Then the attacker could use the vulnerability to steal user cookies or destroy the page structure. This affects: eVDC ZXCLOUD-iROSV6.03.04",0,0,0,1,0,0,0,1,0,0,1,0,0,0
CVE-2022-27022,There is a stack overflow vulnerability in the SetSysTimeCfg() function in the httpd service of Tenda AC9 V15.03.2.21_cn. The attacker can obtain a stable root shell through a constructed payload.,0,0,1,1,0,1,0,0,0,0,0,0,0,0
CVE-2010-1424,Unspecified vulnerability in JustSystems Ichitaro and Ichitaro Government 2006 through 2010 allows user-assisted remote attackers to execute arbitrary code via a crafted font file.,0,0,0,1,0,0,0,0,0,0,0,0,0,0
CVE-2022-21713,"Grafana is an open-source platform for monitoring and observability. Affected versions of Grafana expose multiple API endpoints which do not properly handle user authorization. `/teams/:teamId` will allow an authenticated attacker to view unintended data by querying for the specific team ID, `/teams/:search` will allow an authenticated attacker to search for teams and see the total number of available teams, including for those teams that the user does not have access to, and `/teams/:teamId/members` when editors_can_admin flag is enabled, an authenticated attacker can see unintended data by querying for the specific team ID. Users are advised to upgrade as soon as possible. There are no known workarounds for this issue.",0,0,1,0,0,0,0,0,1,0,1,0,0,0
CVE-2015-3864,"Integer underflow in the MPEG4Extractor::parseChunk function in MPEG4Extractor.cpp in libstagefright in mediaserver in Android before 5.1.1 LMY48M allows remote attackers to execute arbitrary code via crafted MPEG-4 data, aka internal bug 23034759.  NOTE: this vulnerability exists because of an incomplete fix for CVE-2015-3824.",0,0,0,1,0,0,0,0,0,0,0,0,0,0
CVE-2019-15963,"A vulnerability in the web-based management interface of Cisco Unified Communications Manager could allow an authenticated, remote attacker to view sensitive information in the web-based management interface of the affected software. The vulnerability is due to insufficient protection of user-supplied input by the web-based management interface of the affected service. An attacker could exploit this vulnerability by accessing the interface and viewing restricted portions of the software configuration. A successful exploit could allow the attacker to gain access to sensitive information or conduct further attacks.",0,0,1,0,0,0,0,0,0,0,1,0,0,0
CVE-2020-11036,"In GLPI before version 9.4.6 there are multiple related stored XSS vulnerabilities. The package is vulnerable to Stored XSS in the comments of items in the Knowledge base. Adding a comment with content ""<script>alert(1)</script>"" reproduces the attack. This can be exploited by a user with administrator privileges in the User-Agent field. It can also be exploited by an outside party through the following steps: 1. Create a user with the surname `"" onmouseover=""alert(document.cookie)` and an empty first name. 2. With this user, create a ticket 3. As an administrator (or other privileged user) open the created ticket 4. On the ""last update"" field, put your mouse on the name of the user 5. The XSS fires This is fixed in version 9.4.6.",0,0,1,1,0,0,0,0,0,0,1,0,0,0
CVE-2022-20660,"A vulnerability in the information storage architecture of several Cisco IP Phone models could allow an unauthenticated, physical attacker to obtain confidential information from an affected device. This vulnerability is due to unencrypted storage of confidential information on an affected device. An attacker could exploit this vulnerability by physically extracting and accessing one of the flash memory chips. A successful exploit could allow the attacker to obtain confidential information from the device, which could be used for subsequent attacks.",0,0,1,0,0,0,0,1,0,0,0,0,0,0
CVE-2020-12456,"A remote code execution vulnerability in Mitel MiVoice Connect Client before 214.100.1223.0 could allow an attacker to execute arbitrary code in the chat notification window, due to improper rendering of chat messages. A successful exploit could allow an attacker to steal session cookies, perform directory traversal, and execute arbitrary scripts in the context of the Connect client.",0,0,0,1,0,0,0,1,1,0,0,0,0,0
CVE-2018-9206,Unauthenticated arbitrary file upload vulnerability in Blueimp jQuery-File-Upload <= v9.22.0,0,0,1,1,0,0,0,0,0,0,0,0,0,0
CVE-2016-9299,"The remoting module in Jenkins before 2.32 and LTS before 2.19.3 allows remote attackers to execute arbitrary code via a crafted serialized Java object, which triggers an LDAP query to a third-party server.",0,0,0,1,0,0,0,0,0,0,0,0,0,0
CVE-2016-9079,"A use-after-free vulnerability in SVG Animation has been discovered. An exploit built on this vulnerability has been discovered in the wild targeting Firefox and Tor Browser users on Windows. This vulnerability affects Firefox < 50.0.2, Firefox ESR < 45.5.1, and Thunderbird < 45.5.1.",0,0,1,1,0,0,0,0,0,0,0,0,0,0
CVE-2018-14819,"Fuji Electric V-Server 4.0.3.0 and prior, An out-of-bounds read vulnerability has been identified, which may allow remote code execution.",0,0,0,0,1,0,0,0,0,0,0,0,0,0
CVE-2021-21300,"Git is an open-source distributed revision control system. In affected versions of Git a specially crafted repository that contains symbolic links as well as files using a clean/smudge filter such as Git LFS, may cause just-checked out script to be executed while cloning onto a case-insensitive file system such as NTFS, HFS+ or APFS (i.e. the default file systems on Windows and macOS). Note that clean/smudge filters have to be configured for that. Git for Windows configures Git LFS by default, and is therefore vulnerable. The problem has been patched in the versions published on Tuesday, March 9th, 2021. As a workaound, if symbolic link support is disabled in Git (e.g. via `git config --global core.symlinks false`), the described attack won't work. Likewise, if no clean/smudge filters such as Git LFS are configured globally (i.e. _before_ cloning), the attack is foiled. As always, it is best to avoid cloning repositories from untrusted sources. The earliest impacted version is 2.14.2. The fix versions are: 2.30.1, 2.29.3, 2.28.1, 2.27.1, 2.26.3, 2.25.5, 2.24.4, 2.23.4, 2.22.5, 2.21.4, 2.20.5, 2.19.6, 2.18.5, 2.17.62.17.6.",0,0,0,1,0,0,0,0,0,0,0,0,0,0
CVE-2021-22132,Elasticsearch versions 7.7.0 to 7.10.1 contain an information disclosure flaw in the async search API. Users who execute an async search will improperly store the HTTP headers. An Elasticsearch user with the ability to read the .tasks index could obtain sensitive request headers of other users in the cluster. This issue is fixed in Elasticsearch 7.10.2,1,0,0,0,0,0,0,0,1,0,0,0,0,0
CVE-2022-27349,Social Codia SMS v1 was discovered to contain an arbitrary file upload vulnerability via addteacher.php. This vulnerability allows attackers to execute arbitrary code via a crafted PHP file.,0,0,1,0,0,0,0,0,0,0,0,0,0,0
CVE-2021-33624,"In kernel/bpf/verifier.c in the Linux kernel before 5.12.13, a branch can be mispredicted (e.g., because of type confusion) and consequently an unprivileged BPF program can read arbitrary memory locations via a side-channel attack, aka CID-9183671af6db.",0,0,0,0,0,0,0,0,0,0,1,0,1,0
CVE-2021-33831,api/account/register in the TH Wildau COVID-19 Contact Tracing application through 2021-09-01 has Incorrect Access Control. An attacker can interfere with tracing of infection chains by creating 500 random users within 2500 seconds.,0,0,0,0,0,0,0,0,0,0,0,0,0,1
CVE-2019-0880,"A local elevation of privilege vulnerability exists in how splwow64.exe handles certain calls, aka 'Microsoft splwow64 Elevation of Privilege Vulnerability'.",0,0,1,0,0,0,0,0,0,0,0,0,0,0
CVE-2022-23163,"Dell PowerScale OneFS, 8.2,x, 9.1.0.x, 9.2.1.x, and 9.3.0.x contain a denial of service vulnerability. A local malicious user could potentially exploit this vulnerability, leading to denial of service/data unavailability.",0,0,1,0,0,0,0,0,0,0,0,0,0,1
CVE-2021-25646,"Apache Druid includes the ability to execute user-provided JavaScript code embedded in various types of requests. This functionality is intended for use in high-trust environments, and is disabled by default. However, in Druid 0.20.0 and earlier, it is possible for an authenticated user to send a specially-crafted request that forces Druid to run user-provided JavaScript code for that request, regardless of server configuration. This can be leveraged to execute code on the target machine with the privileges of the Druid server process.",0,0,1,1,0,0,0,0,0,0,0,0,0,0
CVE-2012-1557,"SQL injection vulnerability in admin/plib/api-rpc/Agent.php in Parallels Plesk Panel 7.x and 8.x before 8.6 MU#2, 9.x before 9.5 MU#11, 10.0.x before MU#13, 10.1.x before MU#22, 10.2.x before MU#16, and 10.3.x before MU#5 allows remote attackers to execute arbitrary SQL commands via unspecified vectors, as exploited in the wild in March 2012.",0,0,1,0,0,0,0,0,0,0,0,0,0,0
CVE-2021-3164,ChurchRota 2.6.4 is vulnerable to authenticated remote code execution. The user does not need to have file upload permission in order to upload and execute an arbitrary file via a POST request to resources.php.,0,0,1,1,0,0,0,0,0,0,0,0,0,0
CVE-2020-3434,"A vulnerability in the interprocess communication (IPC) channel of Cisco AnyConnect Secure Mobility Client for Windows could allow an authenticated, local attacker to cause a denial of service (DoS) condition on an affected device. To exploit this vulnerability, the attacker would need to have valid credentials on the Windows system. The vulnerability is due to insufficient validation of user-supplied input. An attacker could exploit this vulnerability by sending a crafted IPC message to the AnyConnect process on an affected device. A successful exploit could allow the attacker to stop the AnyConnect process, causing a DoS condition on the device. To exploit this vulnerability, the attacker would need to have valid credentials on the Windows system.",0,0,0,1,0,0,0,0,0,0,0,0,0,1
CVE-2018-11051,"RSA Certificate Manager Versions 6.9 build 560 through 6.9 build 564 contain a path traversal vulnerability in the RSA CMP Enroll Server and the RSA REST Enroll Server. A remote unauthenticated attacker could potentially exploit this vulnerability by manipulating input parameters of the application to gain unauthorized read access to the files stored on the server filesystem, with the privileges of the running web application.",0,0,1,0,0,0,0,0,0,0,1,0,0,0
CVE-2020-3416,"Multiple vulnerabilities in the initialization routines that are executed during bootup of Cisco IOS XE Software for Cisco ASR 900 Series Aggregation Services Routers with a Route Switch Processor 3 (RSP3) installed could allow an authenticated, local attacker with high privileges to execute persistent code at bootup and break the chain of trust. These vulnerabilities are due to incorrect validations by boot scripts when specific ROM monitor (ROMMON) variables are set. An attacker could exploit these vulnerabilities by copying a specific file to the local file system of an affected device and defining specific ROMMON variables. A successful exploit could allow the attacker to run arbitrary code on the underlying operating system (OS) with root privileges. To exploit these vulnerabilities, an attacker would need to have access to the root shell on the device or have physical access to the device.",0,0,1,0,1,0,0,0,0,0,0,0,0,0
CVE-2021-30807,"A memory corruption issue was addressed with improved memory handling. This issue is fixed in macOS Big Sur 11.5.1, iOS 14.7.1 and iPadOS 14.7.1, watchOS 7.6.1. An application may be able to execute arbitrary code with kernel privileges. Apple is aware of a report that this issue may have been actively exploited.",0,0,0,0,0,1,0,0,0,0,0,0,0,0
CVE-2013-0629,"Adobe ColdFusion 9.0, 9.0.1, 9.0.2, and 10, when a password is not configured, allows attackers to access restricted directories via unspecified vectors, as exploited in the wild in January 2013.",0,0,1,0,0,0,0,0,1,0,0,0,0,0
CVE-2020-25052,An issue was discovered on Samsung mobile devices with Q(10.0) (exynos9830 chipsets) software. H-Arx allows attackers to execute arbitrary code or cause a denial of service (memory corruption) because indexes are mishandled. The Samsung ID is SVE-2020-17426 (August 2020).,0,0,0,1,0,0,0,0,0,0,0,0,0,1
CVE-2020-6100,"An exploitable memory corruption vulnerability exists in AMD atidxx64.dll 26.20.15019.19000 graphics driver. A specially crafted pixel shader can cause memory corruption vulnerability. An attacker can provide a specially crafted shader file to trigger this vulnerability. This vulnerability potentially could be triggered from guest machines running virtualization environments (ie. VMware, qemu, VirtualBox etc.) in order to perform guest-to-host escape - as it was demonstrated before (TALOS-2018-0533, TALOS-2018-0568, etc.). Theoretically this vulnerability could be also triggered from web browser (using webGL and webassembly). This vulnerability was triggered from HYPER-V guest using RemoteFX feature leading to executing the vulnerable code on the HYPER-V host (inside of the rdvgm.exe process).",0,0,1,0,0,0,0,0,0,0,0,0,0,1
CVE-2015-1642,"Microsoft Office 2007 SP3, 2010 SP2, and 2013 SP1 allows remote attackers to execute arbitrary code via a crafted document, aka ""Microsoft Office Memory Corruption Vulnerability.""",0,0,0,1,0,0,0,0,0,0,0,0,0,0
CVE-2020-5253,NetHack before version 3.6.0 allowed malicious use of escaping of characters in the configuration file (usually .nethackrc) which could be exploited. This bug is patched in NetHack 3.6.0.,0,0,0,0,1,0,1,0,0,0,0,0,0,1
CVE-2009-3129,"Microsoft Office Excel 2002 SP3, 2003 SP3, and 2007 SP1 and SP2; Office 2004 and 2008 for Mac; Open XML File Format Converter for Mac; Office Excel Viewer 2003 SP3; Office Excel Viewer SP1 and SP2; and Office Compatibility Pack for Word, Excel, and PowerPoint 2007 File Formats SP1 and SP2 allows remote attackers to execute arbitrary code via a spreadsheet with a FEATHEADER record containing an invalid cbHdrData size element that affects a pointer offset, aka ""Excel Featheader Record Memory Corruption Vulnerability.""",0,0,0,1,0,0,0,0,0,0,0,0,0,0
