ID,Text,Reconnaissance,Resource Development,Initial Access,Execution,Persistence,Privilege Escalation,Defense Evasion,Credential Access,Discovery,Lateral Movement,Collection,Command and Control,Exfiltration,Impact
CVE-2020-15100,"In freewvs before 0.1.1, a user could create a large file that freewvs will try to read, which will terminate a scan process. This has been patched in 0.1.1.",0,0,1,0,1,0,0,0,0,0,0,0,0,1
CVE-2017-0262,"Microsoft Office 2010 SP2, Office 2013 SP1, and Office 2016 allow a remote code execution vulnerability when the software fails to properly handle objects in memory, aka ""Office Remote Code Execution Vulnerability"". This CVE ID is unique from CVE-2017-0261 and CVE-2017-0281.",0,0,0,1,0,0,0,0,0,0,0,0,0,0
CVE-2021-33709,"A vulnerability has been identified in Teamcenter Active Workspace V4 (All versions < V4.3.9), Teamcenter Active Workspace V5.0 (All versions < V5.0.7), Teamcenter Active Workspace V5.1 (All versions < V5.1.4). By sending malformed requests, a remote attacker could leak an application token due to an error not properly handled by the system.",0,0,0,1,0,0,0,1,0,0,0,0,0,0
CVE-2021-3393,"An information leak was discovered in postgresql in versions before 13.2, before 12.6 and before 11.11. A user having UPDATE permission but not SELECT permission to a particular column could craft queries which, under some circumstances, might disclose values from that column in error messages. An attacker could use this flaw to obtain information stored in a column they are allowed to write but not read.",0,0,0,1,0,0,0,0,0,0,1,0,0,0
CVE-2022-26850,"When creating or updating credentials for single-user access, Apache NiFi wrote a copy of the Login Identity Providers configuration to the operating system temporary directory. On most platforms, the operating system temporary directory has global read permissions. NiFi immediately moved the temporary file to the final configuration directory, which significantly limited the window of opportunity for access. NiFi 1.16.0 includes updates to replace the Login Identity Providers configuration without writing a file to the operating system temporary directory.",0,0,0,0,0,0,0,1,0,0,0,0,0,0
CVE-2020-6974,"Honeywell Notifier Web Server (NWS) Version 3.50 is vulnerable to a path traversal attack, which allows an attacker to bypass access to restricted directories. Honeywell has released a firmware update to address the problem.",0,0,1,0,0,0,0,0,0,0,1,0,0,1
CVE-2022-22560,Dell EMC PowerScale OneFS 8.1.x - 9.1.x contain hard coded credentials. This allows a local user with knowledge of the credentials to login as the admin user to the backend ethernet switch of a PowerScale cluster. The attacker can exploit this vulnerability to take the switch offline.,0,0,1,0,0,1,0,1,0,0,0,0,0,1
CVE-2021-44427,"An unauthenticated SQL Injection vulnerability in Rosario Student Information System (aka rosariosis) before 8.1.1 allows remote attackers to execute PostgreSQL statements (e.g., SELECT, INSERT, UPDATE, and DELETE) through /Side.php via the syear parameter.",0,0,1,0,0,0,0,0,0,0,0,0,0,0
CVE-2012-3213,"Unspecified vulnerability in the Java Runtime Environment (JRE) component in Oracle Java SE 7 through Update 11 and 6 through Update 38 allows remote attackers to affect confidentiality, integrity, and availability via unknown vectors related to Scripting.",0,0,1,1,0,0,0,0,0,0,0,0,0,0
CVE-2022-0935,Host Header injection in password Reset in GitHub repository livehelperchat/livehelperchat prior to 3.97.,0,0,1,0,0,0,0,0,0,0,0,0,0,0
CVE-2020-4433,"Certain IBM Aspera applications are vulnerable to a stack-based buffer overflow, caused by improper bounds checking. This could allow a remote attacker with intimate knowledge of the server to execute arbitrary code on the system with the privileges of root or cause server to crash. IBM X-Force ID: 180814.",0,0,0,0,1,1,0,0,0,0,0,0,0,1
CVE-2020-14306,"An incorrect access control flaw was found in the operator, openshift-service-mesh/istio-rhel8-operator all versions through 1.1.3. This flaw allows an attacker with a basic level of access to the cluster to deploy a custom gateway/pod to any namespace, potentially gaining access to privileged service account tokens. The highest threat from this vulnerability is to data confidentiality and integrity as well as system availability.",0,0,0,0,0,1,0,0,0,1,0,0,0,1
CVE-2020-3407,"A vulnerability in the RESTCONF and NETCONF-YANG access control list (ACL) function of Cisco IOS XE Software could allow an unauthenticated, remote attacker to cause the device to reload. The vulnerability is due to incorrect processing of the ACL that is tied to the RESTCONF or NETCONF-YANG feature. An attacker could exploit this vulnerability by accessing the device using RESTCONF or NETCONF-YANG. A successful exploit could allow an attacker to cause the device to reload, resulting in a denial of service (DoS) condition.",0,0,1,0,0,0,0,0,0,0,0,0,0,1
CVE-2021-20240,A flaw was found in gdk-pixbuf in versions before 2.42.0. An integer wraparound leading to an out of bounds write can occur when a crafted GIF image is loaded. An attacker may cause applications to crash or could potentially execute code on the victim system. The highest threat from this vulnerability is to data confidentiality and integrity as well as system availability.,0,0,0,1,0,0,0,0,0,0,1,0,0,1
CVE-2018-7520,"An improper access control vulnerability has been identified in Geutebruck G-Cam/EFD-2250 Version 1.12.0.4 and Topline TopFD-2125 Version 3.15.1 IP cameras, which could allow a full configuration download, including passwords.",0,0,0,0,0,0,0,1,0,0,0,0,0,0
CVE-2021-3183,Files.com Fat Client 3.3.6 allows authentication bypass because the client continues to have access after a logout and a removal of a login profile.,0,0,0,0,0,0,1,0,0,0,0,0,0,0
CVE-2012-5958,"Stack-based buffer overflow in the unique_service_name function in ssdp/ssdp_server.c in the SSDP parser in the portable SDK for UPnP Devices (aka libupnp, formerly the Intel SDK for UPnP devices) before 1.6.18 allows remote attackers to execute arbitrary code via a UDP packet with a crafted string that is not properly handled after a certain pointer subtraction.",0,0,1,1,0,0,0,0,0,0,0,0,0,0
CVE-2019-11886,"The WaspThemes Visual CSS Style Editor (aka yellow-pencil-visual-theme-customizer) plugin before 7.2.1 for WordPress allows yp_option_update CSRF, as demonstrated by use of yp_remote_get to obtain admin access.",0,0,1,1,0,0,0,0,0,0,0,0,0,0
CVE-2019-3784,"Cloud Foundry Stratos, versions prior to 2.3.0, contains an insecure session that can be spoofed. When deployed on cloud foundry with multiple instances using the default embedded SQLite database, a remote authenticated malicious user can switch sessions to another user with the same session id.",0,0,0,0,0,0,0,0,0,1,0,0,0,0
CVE-2021-3138,"In Discourse 2.7.0 through beta1, a rate-limit bypass leads to a bypass of the 2FA requirement for certain forms.",0,0,0,0,0,0,0,1,0,0,0,0,0,0
CVE-2019-15287,Multiple vulnerabilities in Cisco Webex Network Recording Player for Microsoft Windows and Cisco Webex Player for Microsoft Windows could allow an attacker to execute arbitrary code on an affected system. The vulnerabilities exist due to insufficient validation of certain elements with a Webex recording stored in either the Advanced Recording Format (ARF) or the Webex Recording Format (WRF). An attacker could exploit these vulnerabilities by sending a user a malicious ARF or WRF file through a link or email attachment and persuading the user to open the file with the affected software on the local system. A successful exploit could allow the attacker to execute arbitrary code on the affected system with the privileges of the targeted user.,0,0,0,1,0,0,0,0,0,0,0,0,0,0
CVE-2021-33701,"DMIS Mobile Plug-In or SAP S/4HANA, versions - DMIS 2011_1_620, 2011_1_640, 2011_1_700, 2011_1_710, 2011_1_730, 710, 2011_1_731, 710, 2011_1_752, 2020, SAPSCORE 125, S4CORE 102, 102, 103, 104, 105, allows an attacker with access to highly privileged account to execute manipulated query in NDZT tool to gain access to Superuser account, leading to SQL Injection vulnerability, that highly impacts systems Confidentiality, Integrity and Availability.",0,0,0,1,0,1,0,0,0,0,0,0,0,0
CVE-2018-15444,"A vulnerability in the web-based user interface of Cisco Energy Management Suite Software could allow an authenticated, remote attacker to gain read and write access to information that is stored on an affected system. The vulnerability is due to improper handling of XML External Entity (XXE) entries when parsing certain XML files. An attacker could exploit this vulnerability by convincing a user of an affected system to import a crafted XML file with malicious entries, which could allow the attacker to read and write files within the affected application.",0,0,1,1,0,0,0,0,0,0,1,0,0,0
CVE-2019-1831,"A vulnerability in the email message scanning of Cisco AsyncOS Software for Cisco Email Security Appliance (ESA) could allow an unauthenticated, remote attacker to bypass configured content filters on the device. The vulnerability is due to improper input validation of the email body. An attacker could exploit this vulnerability by inserting specific character strings in the message. A successful exploit could allow the attacker to bypass configured content filters that would normally drop the email.",0,0,1,0,0,0,1,0,0,0,0,0,0,0
CVE-2020-27486,"Garmin Forerunner 235 before 8.20 is affected by: Buffer Overflow. The component is: ConnectIQ TVM. The attack vector is: To exploit the vulnerability, the attacker must upload a malicious ConnectIQ application to the ConnectIQ store. The ConnectIQ program interpreter trusts the string length provided in the data section of the PRG file. It allocates memory for the string immediately, and then copies the string into the TVM object by using a function similar to strcpy. This copy can exceed the length of the allocated string data and overwrite heap data. A successful exploit would allow a ConnectIQ app store application to escape and perform activities outside the restricted application execution environment.",0,0,0,1,1,1,0,0,0,0,0,0,0,0
CVE-2019-11932,"A double free vulnerability in the DDGifSlurp function in decoding.c in the android-gif-drawable library before version 1.2.18, as used in WhatsApp for Android before version 2.19.244 and many other Android applications, allows remote attackers to execute arbitrary code or cause a denial of service when the library is used to parse a specially crafted GIF image.",0,0,0,1,0,0,0,0,0,0,0,0,0,0
CVE-2020-7334,Improper privilege assignment vulnerability in the installer McAfee Application and Change Control (MACC) prior to 8.3.2 allows local administrators to change or update the configuration settings via a carefully constructed MSI configured to mimic the genuine installer. This version adds further controls for installation/uninstallation of software.,0,0,0,0,1,1,0,0,0,0,0,0,0,0
CVE-2021-20638,LOGITEC LAN-W300N/PGRB allows an attacker with administrative privilege to execute arbitrary OS commands via unspecified vectors.,0,0,0,1,0,0,0,1,0,0,0,0,0,0
CVE-2020-13125,"An issue was discovered in the ""Ultimate Addons for Elementor"" plugin before 1.24.2 for WordPress, as exploited in the wild in May 2020 in conjunction with CVE-2020-13126. Unauthenticated attackers can create users with the Subscriber role even if registration is disabled.",0,0,1,1,0,0,0,0,0,0,0,0,0,1
CVE-2020-1027,"An elevation of privilege vulnerability exists in the way that the Windows Kernel handles objects in memory, aka 'Windows Kernel Elevation of Privilege Vulnerability'. This CVE ID is unique from CVE-2020-0913, CVE-2020-1000, CVE-2020-1003.",0,0,0,0,0,1,0,0,0,0,0,0,0,0
CVE-2022-23598,"laminas-form is a package for validating and displaying simple and complex forms. When rendering validation error messages via the `formElementErrors()` view helper shipped with laminas-form, many messages will contain the submitted value. However, in laminas-form prior to version 3.1.1, the value was not being escaped for HTML contexts, which could potentially lead to a reflected cross-site scripting attack. Versions 3.1.1 and above contain a patch to mitigate the vulnerability. A workaround is available. One may manually place code at the top of a view script where one calls the `formElementErrors()` view helper. More information about this workaround is available on the GitHub Security Advisory.",0,0,0,1,0,0,0,0,0,0,0,0,0,0
CVE-2010-0817,"Cross-site scripting (XSS) vulnerability in _layouts/help.aspx in Microsoft SharePoint Server 2007 12.0.0.6421 and possibly earlier, and SharePoint Services 3.0 SP1 and SP2, versions, allows remote attackers to inject arbitrary web script or HTML via the cid0 parameter.",0,0,1,0,0,0,0,0,0,0,0,0,0,0
CVE-2021-25178,"An issue was discovered in Open Design Alliance Drawings SDK before 2021.11. A stack-based buffer overflow vulnerability exists when the recover operation is run with malformed .DXF and .DWG files. This can allow attackers to cause a crash potentially enabling a denial of service attack (Crash, Exit, or Restart) or possible code execution.",0,0,0,1,0,0,0,0,0,0,0,0,0,1
CVE-2018-16179,"The Mizuho Direct App for Android version 3.13.0 and earlier does not verify server certificates, which allows man-in-the-middle attackers to spoof servers and obtain sensitive information via a crafted certificate.",0,0,0,0,0,0,1,1,0,0,0,0,0,0
CVE-2018-8589,"An elevation of privilege vulnerability exists when Windows improperly handles calls to Win32k.sys, aka ""Windows Win32k Elevation of Privilege Vulnerability."" This affects Windows Server 2008, Windows 7, Windows Server 2008 R2.",0,0,0,1,0,0,0,0,0,0,0,0,0,0
CVE-2020-5269,"In PrestaShop between versions 1.7.6.1 and 1.7.6.5, there is a reflected XSS on AdminFeatures page by using the `id_feature` parameter. The problem is fixed in 1.7.6.5",0,0,0,1,0,0,0,1,0,0,0,0,0,0
CVE-2020-5376,Dell Inspiron 7347 BIOS versions prior to A13 contain a UEFI BIOS Boot Services overwrite vulnerability. A local attacker with access to system memory may exploit this vulnerability by overwriting the EFI_BOOT_SERVICES structure to execute arbitrary code in System Management Mode (SMM).,0,0,0,0,1,0,0,0,0,0,0,0,0,0
CVE-2021-34420,"The Zoom Client for Meetings for Windows installer before version 5.5.4 does not properly verify the signature of files with .msi, .ps1, and .bat extensions. This could lead to a malicious actor installing malicious software on a customer’s computer.",0,0,0,1,0,0,1,0,0,0,0,0,0,0
CVE-2018-14679,"An issue was discovered in mspack/chmd.c in libmspack before 0.7alpha. There is an off-by-one error in the CHM PMGI/PMGL chunk number validity checks, which could lead to denial of service (uninitialized data dereference and application crash).",0,0,0,0,0,0,0,0,0,0,0,0,0,1
CVE-2021-22857,The CGE page with download function contains a Directory Traversal vulnerability. Attackers can use this loophole to download system files arbitrarily.,0,0,0,0,0,0,0,0,1,0,1,0,0,0
CVE-2021-20267,"A flaw was found in openstack-neutron's default Open vSwitch firewall rules. By sending carefully crafted packets, anyone in control of a server instance connected to the virtual switch can impersonate the IPv6 addresses of other systems on the network, resulting in denial of service or in some cases possibly interception of traffic intended for other destinations. Only deployments using the Open vSwitch driver are affected. Source: OpenStack project. Versions before openstack-neutron 15.3.3, openstack-neutron 16.3.1 and openstack-neutron 17.1.1 are affected.",0,0,0,0,0,0,0,0,0,0,1,0,0,1
CVE-2021-27319,Blind SQL injection in contactus.php in Doctor Appointment System 1.0 allows an unauthenticated attacker to insert malicious SQL queries via email parameter.,0,0,0,1,0,0,0,0,0,0,0,0,0,0
CVE-2019-15958,A vulnerability in the REST API of Cisco Prime Infrastructure (PI) and Cisco Evolved Programmable Network Manager (EPNM) could allow an unauthenticated remote attacker to execute arbitrary code with root privileges on the underlying operating system. The vulnerability is due to insufficient input validation during the initial High Availability (HA) configuration and registration process of an affected device. An attacker could exploit this vulnerability by uploading a malicious file during the HA registration period. A successful exploit could allow the attacker to execute arbitrary code with root-level privileges on the underlying operating system. Note: This vulnerability can only be exploited during the HA registration period. See the Details section for more information.,0,0,1,1,0,0,0,0,0,0,0,0,0,0
CVE-2018-0560,Hatena Bookmark App for iOS Version 3.0 to 3.70 allows remote attackers to spoof the address bar via vectors related to URL display.,0,0,0,0,0,0,1,0,0,0,0,0,0,0
CVE-2021-24088,Windows Local Spooler Remote Code Execution Vulnerability,0,0,0,0,0,1,0,0,0,0,0,0,0,0
CVE-2016-0167,"The kernel-mode driver in Microsoft Windows Vista SP2, Windows Server 2008 SP2 and R2 SP1, Windows 7 SP1, Windows 8.1, Windows Server 2012 Gold and R2, Windows RT 8.1, and Windows 10 Gold and 1511 allows local users to gain privileges via a crafted application, aka ""Win32k Elevation of Privilege Vulnerability,"" a different vulnerability than CVE-2016-0143 and CVE-2016-0165.",0,1,0,0,0,0,0,0,0,0,0,0,0,0
CVE-2019-13522,An attacker could use a specially crafted project file to corrupt the memory and execute code under the privileges of the EZ PLC Editor Versions 1.8.41 and prior.,0,0,0,1,1,0,0,0,0,0,0,0,0,0
CVE-2019-1087,"An elevation of privilege exists in Windows Audio Service, aka 'Windows Audio Service Elevation of Privilege Vulnerability'. This CVE ID is unique from CVE-2019-1086, CVE-2019-1088.",0,0,0,0,0,1,0,0,0,0,0,0,0,0
CVE-2021-34780,"Multiple vulnerabilities exist in the Link Layer Discovery Protocol (LLDP) implementation for Cisco Small Business 220 Series Smart Switches. An unauthenticated, adjacent attacker could perform the following: Execute code on the affected device or cause it to reload unexpectedly Cause LLDP database corruption on the affected device For more information about these vulnerabilities, see the Details section of this advisory. Note: LLDP is a Layer 2 protocol. To exploit these vulnerabilities, an attacker must be in the same broadcast domain as the affected device (Layer 2 adjacent). Cisco has released firmware updates that address these vulnerabilities.",0,0,0,1,0,0,0,0,0,0,0,0,0,1
CVE-2020-0938,"A remote code execution vulnerability exists in Microsoft Windows when the Windows Adobe Type Manager Library improperly handles a specially-crafted multi-master font - Adobe Type 1 PostScript format.For all systems except Windows 10, an attacker who successfully exploited the vulnerability could execute code remotely, aka 'Adobe Font Manager Library Remote Code Execution Vulnerability'. This CVE ID is unique from CVE-2020-1020.",0,0,0,1,0,0,0,0,0,0,0,0,0,0
CVE-2019-1620,"A vulnerability in the web-based management interface of Cisco Data Center Network Manager (DCNM) could allow an unauthenticated, remote attacker to upload arbitrary files on an affected device. The vulnerability is due to incorrect permission settings in affected DCNM software. An attacker could exploit this vulnerability by uploading specially crafted data to the affected device. A successful exploit could allow the attacker to write arbitrary files on the filesystem and execute code with root privileges on the affected device.",0,0,0,1,0,0,0,0,0,0,0,1,0,0
CVE-2018-18667,"The mintToken function of Pylon (PYLNT) aka PylonToken, an Ethereum token, has an integer overflow that allows the owner of the contract to set the balance of an arbitrary user to any value, a related issue to CVE-2018-11812.",0,0,0,0,0,0,0,0,0,0,0,0,0,1
CVE-2020-5220,"Sylius ResourceBundle accepts and uses any serialisation groups to be passed via a HTTP header. This might lead to data exposure by using an unintended serialisation group - for example it could make Shop API use a more permissive group from Admin API. Anyone exposing an API with ResourceBundle's controller is affected. The vulnerable versions are: <1.3 || >=1.3.0 <=1.3.12 || >=1.4.0 <=1.4.5 || >=1.5.0 <=1.5.0 || >=1.6.0 <=1.6.2. The patch is provided for Sylius ResourceBundle 1.3.13, 1.4.6, 1.5.1 and 1.6.3, but not for any versions below 1.3.",0,0,1,0,0,0,0,0,0,0,1,0,0,0
CVE-2021-34427,"In Eclipse BIRT versions 4.8.0 and earlier, an attacker can use query parameters to create a JSP file which is accessible from remote (current BIRT viewer dir) to inject JSP code into the running instance.",0,0,0,1,0,0,0,0,0,0,0,0,0,0
CVE-2020-15140,"In Red Discord Bot before version 3.3.11, a RCE exploit has been discovered in the Trivia module: this exploit allows Discord users with specifically crafted usernames to inject code into the Trivia module's leaderboard command. By abusing this exploit, it's possible to perform destructive actions and/or access sensitive information. This critical exploit has been fixed on version 3.3.11.",0,0,1,1,0,0,0,0,0,0,0,0,0,0
CVE-2014-6278,"GNU Bash through 4.3 bash43-026 does not properly parse function definitions in the values of environment variables, which allows remote attackers to execute arbitrary commands via a crafted environment, as demonstrated by vectors involving the ForceCommand feature in OpenSSH sshd, the mod_cgi and mod_cgid modules in the Apache HTTP Server, scripts executed by unspecified DHCP clients, and other situations in which setting the environment occurs across a privilege boundary from Bash execution.  NOTE: this vulnerability exists because of an incomplete fix for CVE-2014-6271, CVE-2014-7169, and CVE-2014-6277.",0,0,1,1,0,0,0,0,0,0,0,0,0,0
CVE-2022-29042,"Jenkins Job Generator Plugin 1.22 and earlier does not escape the name and description of Generator Parameter and Generator Choice parameters on Job Generator jobs' Build With Parameters views, resulting in a stored cross-site scripting (XSS) vulnerability exploitable by attackers with Item/Configure permission.",0,0,1,1,0,0,0,0,0,0,0,0,0,0
CVE-2020-5336,"RSA Archer, versions prior to 6.7 P1 (6.7.0.1), contain a URL injection vulnerability. An unauthenticated attacker could potentially exploit this vulnerability by tricking a victim application user to execute malicious JavaScript code on the affected system.",0,0,0,1,0,0,0,1,0,0,0,0,0,0
CVE-2020-11023,"In jQuery versions greater than or equal to 1.0.3 and before 3.5.0, passing HTML containing <option> elements from untrusted sources - even after sanitizing it - to one of jQuery's DOM manipulation methods (i.e. .html(), .append(), and others) may execute untrusted code. This problem is patched in jQuery 3.5.0.",0,0,0,1,0,0,0,1,0,0,0,0,0,0
CVE-2021-34259,A buffer overflow vulnerability in the USBH_ParseCfgDesc() function of STMicroelectronics STM32Cube Middleware v1.8.0 and below allows attackers to execute arbitrary code.,0,0,0,1,0,0,0,0,0,0,0,0,0,0
CVE-2022-20698,"A vulnerability in the OOXML parsing module in Clam AntiVirus (ClamAV) Software version 0.104.1 and LTS version 0.103.4 and prior versions could allow an unauthenticated, remote attacker to cause a denial of service condition on an affected device. The vulnerability is due to improper checks that may result in an invalid pointer read. An attacker could exploit this vulnerability by sending a crafted OOXML file to an affected device. An exploit could allow the attacker to cause the ClamAV scanning process to crash, resulting in a denial of service condition.",0,0,0,0,0,0,0,0,0,0,0,0,0,1
CVE-2022-1003,"One of the API in Mattermost version 6.3.0 and earlier fails to properly protect the permissions, which allows the system administrators to combine the two distinct privileges/capabilities in a way that allows them to override certain restricted configurations like EnableUploads.",0,0,0,0,0,1,0,0,0,0,0,0,0,0
CVE-2021-44543,An XSS vulnerability was found in Privoxy which was fixed in cgi_error_no_template() by encode the template name when Privoxy is configured to servce the user-manual itself.,0,0,1,0,0,0,0,0,0,0,0,0,0,0
CVE-2022-27649,"A flaw was found in Podman, where containers were started incorrectly with non-empty default permissions. A vulnerability was found in Moby (Docker Engine), where containers were started incorrectly with non-empty inheritable Linux process capabilities. This flaw allows an attacker with access to programs with inheritable file capabilities to elevate those capabilities to the permitted set when execve(2) runs.",0,0,0,1,0,1,0,0,0,0,0,0,0,0
CVE-2019-16760,"Cargo prior to Rust 1.26.0 may download the wrong dependency if your package.toml file uses the `package` configuration key. Usage of the `package` key to rename dependencies in `Cargo.toml` is ignored in Rust 1.25.0 and prior. When Rust 1.25.0 and prior is used Cargo may download the wrong dependency, which could be squatted on crates.io to be a malicious package. This not only affects manifests that you write locally yourself, but also manifests published to crates.io. Rust 1.0.0 through Rust 1.25.0 is affected by this advisory because Cargo will ignore the `package` key in manifests. Rust 1.26.0 through Rust 1.30.0 are not affected and typically will emit an error because the `package` key is unstable. Rust 1.31.0 and after are not affected because Cargo understands the `package` key. Users of the affected versions are strongly encouraged to update their compiler to the latest available one. Preventing this issue from happening requires updating your compiler to be either Rust 1.26.0 or newer. There will be no point release for Rust versions prior to 1.26.0. Users of Rust 1.19.0 to Rust 1.25.0 can instead apply linked patches to mitigate the issue.",0,0,1,0,0,0,1,0,0,0,0,0,0,0
