ID,Text,Reconnaissance,Resource Development,Initial Access,Execution,Persistence,Privilege Escalation,Defense Evasion,Credential Access,Discovery,Lateral Movement,Collection,Command and Control,Exfiltration,Impact
CVE-2021-34685,"UploadService in Hitachi Vantara Pentaho Business Analytics through 9.1 does not properly verify uploaded user files, which allows an authenticated user to upload various files of different file types. Specifically, a .jsp file is not allowed, but a .jsp. file is allowed (and leads to remote code execution).",0,0,0,1,0,0,0,0,0,0,0,0,0,0
CVE-2020-3292,"Multiple vulnerabilities in the web-based management interface of Cisco Small Business RV320 and RV325 Series Routers and Cisco Small Business RV016, RV042, and RV082 Routers could allow an authenticated, remote attacker with administrative privileges to execute arbitrary code on an affected device. The vulnerabilities are due to insufficient boundary restrictions on user-supplied input to scripts in the web-based management interface. An attacker with administrative privileges that are sufficient to log in to the web-based management interface could exploit each vulnerability by sending crafted requests that contain overly large values to an affected device, causing a stack overflow. A successful exploit could allow the attacker to cause the device to crash or allow the attacker to execute arbitrary code with root privileges on the underlying operating system.",0,0,1,1,1,0,0,0,0,0,0,0,0,1
CVE-2020-5217,"In Secure Headers (RubyGem secure_headers), a directive injection vulnerability is present in versions before 3.8.0, 5.1.0, and 6.2.0. If user-supplied input was passed into append/override_content_security_policy_directives, a semicolon could be injected leading to directive injection. This could be used to e.g. override a script-src directive. Duplicate directives are ignored and the first one wins. The directives in secure_headers are sorted alphabetically so they pretty much all come before script-src. A previously undefined directive would receive a value even if SecureHeaders::OPT_OUT was supplied. The fixed versions will silently convert the semicolons to spaces and emit a deprecation warning when this happens. This will result in innocuous browser console messages if being exploited/accidentally used. In future releases, we will raise application errors resulting in 500s. Depending on what major version you are using, the fixed versions are 6.2.0, 5.1.0, 3.8.0.",0,0,0,1,0,0,0,0,0,0,1,0,0,0
CVE-2022-1236,Weak Password Requirements in GitHub repository weseek/growi prior to v5.0.0.,0,0,0,0,0,1,0,1,0,0,0,0,0,0
CVE-2017-14486,"The Vibease Wireless Remote Vibrator app for Android and the Vibease Chat app for iOS use cleartext to exchange messages with other apps and the PLAIN SASL mechanism to send auth tokens to Vibease servers, which allows remote attackers to obtain user credentials, messages, and other sensitive information by sniffing the network for XMPP traffic.",0,0,0,0,0,1,0,0,0,0,0,0,0,1
CVE-2020-14510,"GateManager versions prior to 9.2c, The affected product contains a hard-coded credential for telnet, allowing an unprivileged attacker to execute commands as root.",0,0,1,1,0,1,0,0,0,0,0,0,0,0
CVE-2020-14936,"Buffer overflows were discovered in Contiki-NG 4.4 through 4.5, in the SNMP agent. Functions parsing the OIDs in SNMP requests lack sufficient allocated target-buffer capacity verification when writing parsed OID values. The function snmp_oid_decode_oid() may overwrite memory areas beyond the provided target buffer, when called from snmp_message_decode() upon an SNMP request reception. Because the content of the write operations is externally provided in the SNMP requests, it enables a remote overwrite of an IoT device's memory regions beyond the allocated buffer. This overflow may allow remote overwrite of stack and statically allocated variables memory regions by sending a crafted SNMP request.",0,0,0,0,1,0,0,0,0,0,0,0,0,0
CVE-2013-3660,"The EPATHOBJ::pprFlattenRec function in win32k.sys in the kernel-mode drivers in Microsoft Windows XP SP2 and SP3, Windows Server 2003 SP2, Windows Vista SP2, Windows Server 2008 SP2 and R2 SP1, Windows 7 SP1, Windows 8, and Windows Server 2012 does not properly initialize a pointer for the next object in a certain list, which allows local users to obtain write access to the PATHRECORD chain, and consequently gain privileges, by triggering excessive consumption of paged memory and then making many FlattenPath function calls, aka ""Win32k Read AV Vulnerability.""",0,1,0,0,0,0,0,0,0,0,0,0,0,0
CVE-2020-3120,"A vulnerability in the Cisco Discovery Protocol implementation for Cisco FXOS Software, Cisco IOS XR Software, and Cisco NX-OS Software could allow an unauthenticated, adjacent attacker to cause a reload of an affected device, resulting in a denial of service (DoS) condition. The vulnerability is due to a missing check when the affected software processes Cisco Discovery Protocol messages. An attacker could exploit this vulnerability by sending a malicious Cisco Discovery Protocol packet to an affected device. A successful exploit could allow the attacker to exhaust system memory, causing the device to reload. Cisco Discovery Protocol is a Layer 2 protocol. To exploit this vulnerability, an attacker must be in the same broadcast domain as the affected device (Layer 2 adjacent).",0,0,0,0,0,0,0,0,0,0,0,0,0,1
CVE-2022-27346,Ecommece-Website v1.1.0 was discovered to contain an arbitrary file upload vulnerability via /admin/index.php?slides. This vulnerability allows attackers to execute arbitrary code via a crafted PHP file.,0,0,1,1,0,0,0,0,0,0,0,0,0,0
CVE-2022-1243,CRHTLF can lead to invalid protocol extraction potentially leading to XSS in GitHub repository medialize/uri.js prior to 1.19.11.,0,0,0,0,0,0,0,0,0,0,0,0,1,0
CVE-2020-15143,"In SyliusResourceBundle before versions 1.3.14, 1.4.7, 1.5.2 and 1.6.4, rrequest parameters injected inside an expression evaluated by `symfony/expression-language` package haven't been sanitized properly. This allows the attacker to access any public service by manipulating that request parameter, allowing for Remote Code Execution. This issue has been patched for versions 1.3.14, 1.4.7, 1.5.2 and 1.6.4. Versions prior to 1.3 were not patched.",0,0,1,1,0,0,0,0,0,0,0,0,0,0
CVE-2018-11062,"Integrated Data Protection Appliance versions 2.0, 2.1, and 2.2 contain undocumented accounts named 'support' and 'admin' that are protected with default passwords. These accounts have limited privileges and can access certain system files only. A malicious user with the knowledge of the default passwords may potentially log in to the system and gain read and write access to certain system files.",0,0,1,0,0,0,0,0,0,0,0,0,0,0
CVE-2013-3900,"The WinVerifyTrust function in Microsoft Windows XP SP2 and SP3, Windows Server 2003 SP2, Windows Vista SP2, Windows Server 2008 SP2 and R2 SP1, Windows 7 SP1, Windows 8, Windows 8.1, Windows Server 2012 Gold and R2, and Windows RT Gold and 8.1 does not properly validate PE file digests during Authenticode signature verification, which allows remote attackers to execute arbitrary code via a crafted PE file, aka ""WinVerifyTrust Signature Validation Vulnerability.""",0,0,1,0,0,0,0,1,0,0,0,0,0,0
CVE-2018-15462,"A vulnerability in the TCP ingress handler for the data interfaces that are configured with management access to Cisco Firepower Threat Defense (FTD) Software could allow an unauthenticated, remote attacker to cause an increase in CPU and memory usage, resulting in a denial of service (DoS) condition. The vulnerability is due to insufficient ingress TCP rate limiting for TCP ports 22 (SSH) and 443 (HTTPS). An attacker could exploit this vulnerability by sending a crafted, steady stream of TCP traffic to port 22 or 443 on the data interfaces that are configured with management access to the affected device.",0,0,1,0,0,0,0,0,0,0,0,0,0,1
CVE-2020-5252,"The command-line ""safety"" package for Python has a potential security issue. There are two Python characteristics that allow malicious code to “poison-pill” command-line Safety package detection routines by disguising, or obfuscating, other malicious or non-secure packages. This vulnerability is considered to be of low severity because the attack makes use of an existing Python condition, not the Safety tool itself. This can happen if: You are running Safety in a Python environment that you don’t trust. You are running Safety from the same Python environment where you have your dependencies installed. Dependency packages are being installed arbitrarily or without proper verification. Users can mitigate this issue by doing any of the following: Perform a static analysis by installing Docker and running the Safety Docker image: $ docker run --rm -it pyupio/safety check -r requirements.txt Run Safety against a static dependencies list, such as the requirements.txt file, in a separate, clean Python environment. Run Safety from a Continuous Integration pipeline. Use PyUp.io, which runs Safety in a controlled environment and checks Python for dependencies without any need to install them. Use PyUp's Online Requirements Checker.",0,0,1,0,0,0,0,0,0,0,0,0,0,0
CVE-2022-29039,"Jenkins Gerrit Trigger Plugin 2.35.2 and earlier does not escape the name and description of Base64 Encoded String parameters on views displaying parameters, resulting in a stored cross-site scripting (XSS) vulnerability exploitable by attackers with Item/Configure permission.",0,0,1,1,0,0,0,0,0,0,0,0,0,0
CVE-2020-11059,"In AEgir greater than or equal to 21.7.0 and less than 21.10.1, aegir publish and aegir build may leak secrets from environment variables in the browser bundle published to npm. This has been fixed in 21.10.1.",0,0,0,0,0,0,0,0,0,0,1,0,0,0
CVE-2019-12660,"A vulnerability in the CLI of Cisco IOS XE Software could allow an authenticated, local attacker to write values to the underlying memory of an affected device. The vulnerability is due to improper input validation and authorization of specific commands that a user can execute within the CLI. An attacker could exploit this vulnerability by authenticating to an affected device and issuing a specific set of commands. A successful exploit could allow the attacker to modify the configuration of the device to cause it to be non-secure and abnormally functioning.",0,0,1,0,1,0,1,0,0,0,0,0,0,0
CVE-2021-35037,"Jamf Pro before 10.30.1 allows for an unvalidated URL redirect vulnerability affecting Jamf Pro customers who host their environments on-premises. An attacker may craft a URL that appears to be for a customer's Jamf Pro instance, but when clicked will forward a user to an arbitrary URL that may be malicious. This is tracked via Jamf with the following ID: PI-009822",0,0,0,1,0,0,0,0,0,0,0,0,0,0
CVE-2014-0266,"The XMLHTTP ActiveX controls in XML Core Services 3.0 in Microsoft Windows XP SP2 and SP3, Windows Server 2003 SP2, Windows Vista SP2, Windows Server 2008 SP2 and R2 SP1, Windows 7 SP1, Windows 8, Windows 8.1, Windows Server 2012 Gold and R2, and Windows RT Gold and 8.1 allow remote attackers to bypass the Same Origin Policy via a web page that is visited in Internet Explorer, aka ""MSXML Information Disclosure Vulnerability.""",0,0,1,1,0,0,0,0,0,0,0,0,0,0
CVE-2020-25613,"An issue was discovered in Ruby through 2.5.8, 2.6.x through 2.6.6, and 2.7.x through 2.7.1. WEBrick, a simple HTTP server bundled with Ruby, had not checked the transfer-encoding header value rigorously. An attacker may potentially exploit this issue to bypass a reverse proxy (which also has a poor header check), which may lead to an HTTP Request Smuggling attack.",0,0,0,0,0,0,0,1,0,0,0,0,0,0
CVE-2019-3758,"RSA Archer, versions prior to 6.6 P2 (6.6.0.2), contain an improper authentication vulnerability. The vulnerability allows sysadmins to create user accounts with insufficient credentials. Unauthenticated attackers could gain unauthorized access to the system using those accounts.",0,0,1,0,1,0,0,0,0,0,0,0,0,0
CVE-2018-11073,"RSA Authentication Manager versions prior to 8.3 P3 contain a stored cross-site scripting vulnerability in the Operations Console. A malicious Operations Console administrator could exploit this vulnerability to store arbitrary HTML or JavaScript code through the web interface. When other Operations Console administrators open the affected page, the injected scripts could potentially be executed in their browser.",0,0,1,1,0,0,0,0,0,0,1,0,0,0
CVE-2013-3906,"GDI+ in Microsoft Windows Vista SP2 and Server 2008 SP2; Office 2003 SP3, 2007 SP3, and 2010 SP1 and SP2; Office Compatibility Pack SP3; and Lync 2010, 2010 Attendee, 2013, and Basic 2013 allows remote attackers to execute arbitrary code via a crafted TIFF image, as demonstrated by an image in a Word document, and exploited in the wild in October and November 2013.",0,0,1,1,0,0,0,0,0,0,0,0,0,0
CVE-2015-7756,"The encryption implementation in Juniper ScreenOS 6.2.0r15 through 6.2.0r18, 6.3.0r12 before 6.3.0r12b, 6.3.0r13 before 6.3.0r13b, 6.3.0r14 before 6.3.0r14b, 6.3.0r15 before 6.3.0r15b, 6.3.0r16 before 6.3.0r16b, 6.3.0r17 before 6.3.0r17b, 6.3.0r18 before 6.3.0r18b, 6.3.0r19 before 6.3.0r19b, and 6.3.0r20 before 6.3.0r21 makes it easier for remote attackers to discover the plaintext content of VPN sessions by sniffing the network for ciphertext data and conducting an unspecified decryption attack.",0,0,1,1,0,0,0,0,0,0,0,0,0,1
CVE-2022-0129,Uncontrolled search path element vulnerability in McAfee TechCheck prior to 4.0.0.2 allows a local administrator to load their own Dynamic Link Library (DLL) gaining elevation of privileges to system user. This was achieved through placing the malicious DLL in the same directory that the process was run from.,0,0,0,1,0,1,0,0,0,0,0,0,0,0
CVE-2021-1499,"A vulnerability in the web-based management interface of Cisco HyperFlex HX Data Platform could allow an unauthenticated, remote attacker to upload files to an affected device. This vulnerability is due to missing authentication for the upload function. An attacker could exploit this vulnerability by sending a specific HTTP request to an affected device. A successful exploit could allow the attacker to upload files to the affected device with the permissions of the tomcat8 user.",0,0,0,1,0,0,0,0,0,0,0,0,0,0
CVE-2020-5295,"In OctoberCMS (october/october composer package) versions from 1.0.319 and before 1.0.466, an attacker can exploit this vulnerability to read local files of an October CMS server. The vulnerability is only exploitable by an authenticated backend user with the `cms.manage_assets` permission. Issue has been patched in Build 466 (v1.0.466).",0,0,1,0,0,0,0,0,0,0,1,0,0,0
CVE-2021-33703,"Under certain conditions, NetWeaver Enterprise Portal, versions - 7.30, 7.31, 7.40, 7.50, does not sufficiently encode URL parameters. An attacker can craft a malicious link and send it to a victim. A successful attack results in Reflected Cross-Site Scripting (XSS) vulnerability.",0,0,0,1,0,0,0,0,0,0,0,0,0,0
CVE-2021-3344,"A privilege escalation flaw was found in OpenShift builder. During build time, credentials outside the build context are automatically mounted into the container image under construction. An OpenShift user, able to execute code during build time inside this container can re-use the credentials to overwrite arbitrary container images in internal registries and/or escalate their privileges. The highest threat from this vulnerability is to data confidentiality and integrity as well as system availability. This affects github.com/openshift/builder v0.0.0-20210125201112-7901cb396121 and before.",0,0,0,0,0,1,0,1,0,0,0,0,0,0
CVE-2021-20184,"It was found in Moodle before version 3.10.1, 3.9.4 and 3.8.7 that a insufficient capability checks in some grade related web services meant students were able to view other students grades.",1,0,0,0,0,0,0,0,0,0,0,0,0,0
CVE-2017-11847,"Windows kernel in Windows 7 SP1, Windows Server 2008 SP2 and R2 SP1, Windows 8.1 and RT1, Windows Server 2012 and R2, Windows 10 Gold, 1511, 1607, 1703, and 1709, Windows Server 2016, and Windows Server, version 1709 allows an attacker to run arbitrary code in kernel mode, install programs, view, change or delete data, and create new accounts with full user rights due to improperly handing objects in memory, aka ""Windows Kernel Elevation of Privilege Vulnerability"".",0,0,1,1,0,0,0,0,0,0,0,0,0,0
CVE-2020-11083,"In October from version 1.0.319 and before version 1.0.466, a user with access to a markdown FormWidget that stores data persistently could create a stored XSS attack against themselves and any other users with access to the generated HTML from the field. This has been fixed in 1.0.466. For users of the RainLab.Blog plugin, this has also been fixed in 1.4.1.",0,0,0,0,0,0,0,0,0,0,1,0,0,0
CVE-2022-27386,MariaDB Server v10.7 and below was discovered to contain a segmentation fault via the component sql/sql_class.cc.,0,0,1,1,0,0,0,0,0,0,0,0,0,1
CVE-2022-26110,"An issue was discovered in HTCondor 8.8.x before 8.8.16, 9.0.x before 9.0.10, and 9.1.x before 9.6.0. When a user authenticates to an HTCondor daemon via the CLAIMTOBE method, the user can then impersonate any entity when issuing additional commands to that daemon.",0,0,1,1,0,0,0,0,0,0,0,0,0,0
CVE-2019-18935,"Progress Telerik UI for ASP.NET AJAX through 2019.3.1023 contains a .NET deserialization vulnerability in the RadAsyncUpload function. This is exploitable when the encryption keys are known due to the presence of CVE-2017-11317 or CVE-2017-11357, or other means. Exploitation can result in remote code execution. (As of 2020.1.114, a default setting prevents the exploit. In 2019.3.1023, but not earlier versions, a non-default setting can prevent exploitation.)",0,0,1,1,0,0,0,0,0,0,0,0,0,0
CVE-2016-5180,Heap-based buffer overflow in the ares_create_query function in c-ares 1.x before 1.12.0 allows remote attackers to cause a denial of service (out-of-bounds write) or possibly execute arbitrary code via a hostname with an escaped trailing dot.,0,0,1,1,0,0,0,0,0,0,0,0,0,1
CVE-2019-0708,"A remote code execution vulnerability exists in Remote Desktop Services formerly known as Terminal Services when an unauthenticated attacker connects to the target system using RDP and sends specially crafted requests, aka 'Remote Desktop Services Remote Code Execution Vulnerability'.",0,0,0,0,1,1,0,0,0,0,0,0,0,0
CVE-2022-27381,An issue in the component Field::set_default of MariaDB Server v10.6 and below was discovered to allow attackers to cause a Denial of Service (DoS) via specially crafted SQL statements.,0,0,1,1,0,0,0,0,0,0,0,0,0,1
CVE-2018-18990,LCDS Laquis SCADA prior to version 4.1.0.4150 allows a user-supplied path in file operations prior to proper validation. An attacker can leverage this vulnerability to disclose sensitive information under the context of the web server process.,0,0,0,0,0,0,0,0,0,0,1,0,0,0
CVE-2019-1594,"A vulnerability in the 802.1X implementation for Cisco NX-OS Software could allow an unauthenticated, adjacent attacker to cause a denial of service (DoS) condition on an affected device. The vulnerability is due to incomplete input validation of Extensible Authentication Protocol over LAN (EAPOL) frames. An attacker could exploit this vulnerability by sending a crafted EAPOL frame to an interface on the targeted device. A successful exploit could allow the attacker to cause the Layer 2 (L2) forwarding process to restart multiple times, leading to a system-level restart of the device and a DoS condition. Note: This vulnerability affects only NX-OS devices configured with 802.1X functionality. Cisco Nexus 1000V Switch for VMware vSphere devices are affected in versions prior to 5.2(1)SV3(1.4b). Nexus 3000 Series Switches are affected in versions prior to 7.0(3)I7(4). Nexus 3500 Platform Switches are affected in versions prior to 7.0(3)I7(4). Nexus 2000, 5500, 5600, and 6000 Series Switches are affected in versions prior to 7.3(5)N1(1) and 7.1(5)N1(1b). Nexus 7000 and 7700 Series Switches are affected in versions prior to 8.2(3). Nexus 9000 Series Fabric Switches in ACI Mode are affected in versions prior to 13.2(1l). Nexus 9000 Series Switches in Standalone NX-OS Mode are affected in versions prior to 7.0(3)I7(4).",0,0,1,0,0,0,0,0,0,0,0,0,0,1
CVE-2018-17934,"NUUO CMS All versions 3.3 and prior the application allows external input to construct a pathname that is able to be resolved outside the intended directory. This could allow an attacker to impersonate a legitimate user, obtain restricted information, or execute arbitrary code.",0,0,0,1,0,0,1,0,0,0,1,0,0,0
CVE-2020-3387,"A vulnerability in Cisco SD-WAN vManage Software could allow an authenticated, remote attacker to execute code with root privileges on an affected system. The vulnerability is due to insufficient input sanitization during user authentication processing. An attacker could exploit this vulnerability by sending a crafted response to the Cisco SD-WAN vManage Software. A successful exploit could allow the attacker to access the software and execute commands they should not be authorized to execute.",0,0,1,0,1,1,0,0,0,0,0,0,0,0
CVE-2009-1800,"Stack-based buffer overflow in the Chinagames CGAgent ActiveX control 1.x in CGAgent.dll, as distributed in Chinagames iGame 2009, allows remote attackers to execute arbitrary code via a long argument to the CreateChinagames method, as exploited in the wild in April and May 2009.  NOTE: some of these details are obtained from third party information.",0,0,0,1,0,0,0,0,0,0,0,0,0,0
CVE-2021-20575,IBM Security Verify Access 20.07 allows web pages to be stored locally which can be read by another user on the system. X-Force ID: 199278.,0,0,0,0,0,0,0,0,0,0,1,0,0,0
CVE-2022-26643,An issue in EasyIO CPT Graphics v0.8 allows attackers to discover valid users in the application.,0,0,0,0,0,0,0,0,1,0,0,0,0,0
CVE-2014-1815,"Microsoft Internet Explorer 6 through 11 allows remote attackers to execute arbitrary code or cause a denial of service (memory corruption) via a crafted web site, as exploited in the wild in May 2014, aka ""Internet Explorer Memory Corruption Vulnerability,"" a different vulnerability than CVE-2014-0310.",0,0,1,1,0,0,0,0,0,0,0,0,0,0
CVE-2014-2817,"Microsoft Internet Explorer 6 through 11 allows remote attackers to gain privileges via a crafted web site, aka ""Internet Explorer Elevation of Privilege Vulnerability.""",0,0,1,1,0,0,0,0,0,0,0,0,0,0
CVE-2020-35788,NETGEAR WAC104 devices before 1.0.4.13 are affected by a buffer overflow by an authenticated user.,0,0,1,0,1,0,0,0,0,0,0,0,0,0
CVE-2021-35039,"kernel/module.c in the Linux kernel before 5.12.14 mishandles Signature Verification, aka CID-0c18f29aae7c. Without CONFIG_MODULE_SIG, verification that a kernel module is signed, for loading via init_module, does not occur for a module.sig_enforce=1 command-line argument.",0,0,0,0,0,1,1,0,0,0,0,0,0,0
CVE-2020-16211,"Advantech WebAccess HMI Designer, Versions 2.1.9.31 and prior. An out-of-bounds read vulnerability may be exploited by processing specially crafted project files, which may allow an attacker to read information.",0,0,0,1,0,0,0,0,0,0,1,0,0,0
CVE-2020-28035,WordPress before 5.5.2 allows attackers to gain privileges via XML-RPC,0,0,0,0,0,1,0,0,0,0,0,0,0,0
CVE-2016-10229,udp.c in the Linux kernel before 4.5 allows remote attackers to execute arbitrary code via UDP traffic that triggers an unsafe second checksum calculation during execution of a recv system call with the MSG_PEEK flag,0,0,0,1,0,0,1,0,0,0,0,0,0,0
CVE-2019-3754,"Dell EMC Unity Operating Environment versions prior to 5.0.0.0.5.116, Dell EMC UnityVSA versions prior to 5.0.0.0.5.116 and Dell EMC VNXe3200 versions prior to 3.1.10.9946299 contain a reflected cross-site scripting vulnerability on the cas/logout page. A remote unauthenticated attacker could potentially exploit this vulnerability by tricking a victim application user to supply malicious HTML or Java Script code to Unisphere, which is then reflected back to the victim and executed by the web browser.",0,0,0,1,0,0,0,1,0,0,0,0,0,0
CVE-2015-0096,"Untrusted search path vulnerability in Microsoft Windows Server 2003 SP2, Windows Vista SP2, Windows Server 2008 SP2 and R2 SP1, Windows 7 SP1, Windows 8, Windows 8.1, Windows Server 2012 Gold and R2, and Windows RT Gold and 8.1 allows local users to gain privileges via a Trojan horse DLL in the current working directory, leading to DLL loading during Windows Explorer access to the icon of a crafted shortcut, aka ""DLL Planting Remote Code Execution Vulnerability.""",0,0,0,1,0,0,0,0,0,0,0,0,0,0
CVE-2018-5451,"In Philips Alice 6 System version R8.0.2 or prior, when an actor claims to have a given identity, the software does not prove or insufficiently proves that the claim is correct. This weakness can lead to the exposure of resources or functionality to unintended actors, possibly providing attackers with sensitive information or the ability to execute arbitrary code.",0,0,0,0,0,0,1,0,0,0,0,0,0,0
